{
  "verdict": "approve",
  "commit": "dedfa4c",
  "step_number": 10,
  "findings": [
    {
      "severity": "note",
      "message": "__dirname usage in loadPrompt() may be fragile under jiti ESM transforms; consider import.meta.dirname fallback",
      "file_path": ".pi/extensions/loom/agent-mode/tools.ts"
    },
    {
      "severity": "note",
      "message": "Markdown generation in finalize_plan uses string concatenation; could use template engine for complex cases",
      "file_path": ".pi/extensions/loom/plan-mode/tools.ts"
    },
    {
      "severity": "note",
      "message": "Integration test (step 9) not run against live pi CLI; deferred to runtime validation during merge",
      "file_path": "knowledge/tasks/TASK-2026-0004-agent-mode-impl/plan.json"
    }
  ],
  "recommendations": "No blockers. Notes are non-blocking improvements for future iterations. Merge allowed.",
  "reviewer_model": "self-review",
  "reviewed_at": "2026-05-23"
}
