{
  "verdict": "approve",
  "commit": "8fb739b",
  "step_number": 9,
  "findings": [],
  "recommendations": "Memory layer DU-1 полностью реализован. Все 4 дорожки имеют API, Context Assembler соблюдает token budget, backward compatibility сохранена через opt-in флаг use_memory_v2. Рекомендуется активация use_memory_v2=true в execution-config.json после ручного тестирования на пилотной задаче.",
  "reviewer_model": "operator",
  "reviewed_at": "2026-05-24"
}
